Produk,Rating,Ulasan,Clean_Ulasan,Sentiment,Word_Count,Char_Count,Length_Category
Xiaomi Electric Shaver S200,5,"Berfungsi dgn baik, namun sayang pengiriman agak lama. Dr hr sabtu sdh sampai dikota sya, namun senin br d antar k alamat.",berfungsi dgn baik namun sayang pengiriman agak lama dr hr sabtu sdh sampai dikota sya namun senin br d antar k alamat,Positif,22,122,Panjang (>15 kata)
Xiaomi Redmi Headphones Neo,5,"kualitas suara bagus, bass juga nendang. bisa konek ke smart tv juga.",kualitas suara bagus bass juga nendang bisa konek ke smart tv juga,Positif,12,69,Sedang (9–15 kata)
POCO M7 (8GB/256GB),5,sip bagus dan normal semua,sip bagus dan normal semua,Positif,5,26,Singkat (4–8 kata)
Xiaomi Redmi Pad 2 Series,5,"Barang berfungsi baik, gambar dan suaranya juga bagus. Paket diterima utuh tidak rusak.",barang berfungsi baik gambar dan suaranya juga bagus paket diterima utuh tidak rusak,Positif,13,87,Sedang (9–15 kata)
POCO X8 Pro Series,5,"paket sesuai pesanan..
masih segel.
mantap",paket sesuai pesanan masih segel mantap,Positif,6,42,Singkat (4–8 kata)
Xiaomi Redmi Note 15 (6/128 GB),5,sampai dengan pengiriman yang cepat dan aman. official store tidak pernah mengecewakan,sampai dengan pengiriman yang cepat dan aman official store tidak pernah mengecewakan,Positif,12,86,Sedang (9–15 kata)
Xiaomi 17T (12GB+256GB),5,MANTAPPP,mantappp,Positif,1,8,Sangat Singkat (≤3 kata)
Xiaomi 17T (12GB+256GB),5,dapat diskon dan dapat bonus,dapat diskon dan dapat bonus,Positif,5,28,Singkat (4–8 kata)
POCO M7 (8GB/256GB),5,"bagusss, real pick",bagusss real pick,Positif,3,18,Sangat Singkat (≤3 kata)
Xiaomi TV A Pro 32 2026,5,mntp,mntp,Positif,1,4,Sangat Singkat (≤3 kata)
Xiaomi TV Box S (3rd Gen),5,Semoga bermanfaat. terima kasih,semoga bermanfaat terima kasih,Positif,4,31,Singkat (4–8 kata)
Xiaomi 17T (12GB+256GB),5,"Cepet sampai
Barang ori
Bonus keren",cepet sampai barang ori bonus keren,Positif,6,35,Singkat (4–8 kata)
POCO F8 Series,5,"dari jaman poco f2 pro ga pernah nyesel pake nih hp, awet ya f8 pro ini 😇🙏🏻",dari jaman poco f2 pro ga pernah nyesel pake nih hp awet ya f8 pro ini,Positif,16,75,Panjang (>15 kata)
Xiaomi TV A 32,5,ok terbaik,ok terbaik,Positif,2,10,Sangat Singkat (≤3 kata)
Xiaomi Smart Camera C301 CCTV Indoor,5,Blm tau bagus or gk cz buat kado semoga bagus,blm tau bagus or gk cz buat kado semoga bagus,Positif,10,45,Sedang (9–15 kata)
POCO X8 Pro Series,5,barang cepat sampai tp blm dicoba,barang cepat sampai tp blm dicoba,Positif,6,33,Singkat (4–8 kata)
Xiaomi Smart Air Purifier 4 Compact,1,"wah ga nyangka customer service nya sejelek ini hebat 👏🏽👏🏽👏🏽👏🏽👏🏽 makasih banyak pelajaran nya. janji gak akan pernah beli produk xiaomi lagi.

***congratulation...",wah ga nyangka customer service nya sejelek ini hebat makasih banyak pelajaran nya janji gak akan pernah beli produk xiaomi lagi congratulation,Negatif,22,163,Panjang (>15 kata)
Xiaomi TV Box S (3rd Gen),5,"Manteb kk, fungsi normal",manteb kk fungsi normal,Positif,4,24,Singkat (4–8 kata)
Xiaomi Earphone Tipe-C,5,"Respon seller dan pengiriman cepat. 
Kualitas oke. Terima kasih",respon seller dan pengiriman cepat kualitas oke terima kasih,Positif,9,63,Sedang (9–15 kata)
Xiaomi Redmi Buds 8 Active,5,keren semoga awet,keren semoga awet,Positif,3,17,Sangat Singkat (≤3 kata)
POCO M7 (8GB/256GB),5,"Alhamdulillah hp baru, Terimakasih",alhamdulillah hp baru terimakasih,Positif,4,34,Singkat (4–8 kata)
Xiaomi Redmi Note 15 5G (8/256 GB) (12/512 GB),5,barang bagus,barang bagus,Positif,2,12,Sangat Singkat (≤3 kata)
Xiaomi Earphone Tipe-C,5,cocok,cocok,Positif,1,5,Sangat Singkat (≤3 kata)
Xiaomi TV A Pro 32 2026,5,Bagus dan memuaskan,bagus dan memuaskan,Positif,3,19,Sangat Singkat (≤3 kata)
POCO M7 Pro 5G (8/256G),5,"Pengiriman kurir cepat.
Barang original, segel, isi lengkap, official store Xiaomi tidak mengecewakan.",pengiriman kurir cepat barang original segel isi lengkap official store xiaomi tidak mengecewakan,Positif,13,102,Sedang (9–15 kata)
POCO M7 (8GB/256GB),5,"barang bagus kondisi masih segel, cuman bubble kurang banyak, tapi masih aman",barang bagus kondisi masih segel cuman bubble kurang banyak tapi masih aman,Positif,12,77,Sedang (9–15 kata)
Xiaomi 17T (12GB+256GB),5,mantab promo ya,mantab promo ya,Positif,3,15,Sangat Singkat (≤3 kata)
Xiaomi 33W Charging Combo Tipe A,5,nice turbo charging.. makasih,nice turbo charging makasih,Positif,4,29,Singkat (4–8 kata)
POCO X8 Pro Series,5,kekekemwmxmckkmmxmekeksoxoxoxoxoxoodkekekrlflff,kekekemwmxmckkmmxmekeksoxoxoxoxoxoodkekekrlflff,Positif,1,47,Sangat Singkat (≤3 kata)
POCO X8 Pro Series,5,jdkenrnmrmrmrmfmdmsmsmmsmwmememrmrkkfkckckckdkdkdksksksks,jdkenrnmrmrmrmfmdmsmsmmsmwmememrmrkkfkckckckdkdkdksksksks,Positif,1,57,Sangat Singkat (≤3 kata)
Xiaomi 90W HyperCharge Combo (Type-A),5,barang nya masih tersegel sampai tujuan dan berfungsi sangat baik. smoga awet casannya,barang nya masih tersegel sampai tujuan dan berfungsi sangat baik smoga awet casannya,Positif,13,86,Sedang (9–15 kata)
POCO X8 Pro Series,5,Cantik n harga sesuai,cantik n harga sesuai,Positif,4,21,Singkat (4–8 kata)
Xiaomi 17T (12GB+256GB),5,"barang sudah diterima, sejauh ini tidak ada problem",barang sudah diterima sejauh ini tidak ada problem,Positif,8,51,Singkat (4–8 kata)
POCO X8 Pro Series,5,"Sesuai pesanan, mantap",sesuai pesanan mantap,Positif,3,22,Sangat Singkat (≤3 kata)
POCO X8 Pro Series,5,"Sesuai pesanan, mantap",sesuai pesanan mantap,Positif,3,22,Sangat Singkat (≤3 kata)
Xiaomi 17T (12GB+256GB),5,terima kasih,terima kasih,Positif,2,12,Sangat Singkat (≤3 kata)
Xiaomi Smart Multifunctional Rice Cooker,5,"akhirnya bisa connect ke mi home, belum dicoba",akhirnya bisa connect ke mi home belum dicoba,Positif,8,46,Singkat (4–8 kata)
Xiaomi Monitor A27i,5,"mantap lah buat secondary monitor, gada deadpixel lagi👍🏻",mantap lah buat secondary monitor gada deadpixel lagi,Positif,8,56,Singkat (4–8 kata)
Xiaomi 165W Power Bank 10000mAh Integrated Cable,5,waduh mantap seusai deskripsi,waduh mantap seusai deskripsi,Positif,4,29,Singkat (4–8 kata)
Xiaomi TV Box S (3rd Gen),5,Berfungsi dengan baik,berfungsi dengan baik,Positif,3,21,Sangat Singkat (≤3 kata)
Xiaomi 17T (12GB+256GB),5,"pengiriman super cepat hanya 1 hari, barangnya oke punya... puas banget + dapat bonus headphones neo",pengiriman super cepat hanya 1 hari barangnya oke punya puas banget dapat bonus headphones neo,Positif,15,100,Sedang (9–15 kata)
Xiaomi Redmi Buds 6 Play,5,"BONUS DILAMPIRKAN, TERIMA KASIH",bonus dilampirkan terima kasih,Positif,4,31,Singkat (4–8 kata)
Xiaomi Redmi Note 15 5G (6/128 GB),5,"PENGIRIMAN CEPAT, BARANG BERFUNGSI / SESUAI, PACKING AMAN, DAN SEGEL TERJAGA",pengiriman cepat barang berfungsi sesuai packing aman dan segel terjaga,Positif,10,76,Sedang (9–15 kata)
Xiaomi Smart Camera C301 CCTV Indoor,4,"Baru dicoba, semoga awet",baru dicoba semoga awet,Positif,4,24,Singkat (4–8 kata)
POCO M7 Pro 5G (8/256G),5,"barang sudah diterima dgn baik, pengiriman diproses cepat , tinggal ditest fungsi dan fitur2 Hp nya, semoga aman lancar dan awet pemakaian, thanks Xiaomi Indomesia &...",barang sudah diterima dgn baik pengiriman diproses cepat tinggal ditest fungsi dan fitur2 hp nya semoga aman lancar dan awet pemakaian thanks xiaomi indomesia,Positif,24,168,Panjang (>15 kata)
Xiaomi 33W Power Bank 20.000 mAh,5,produk sudah diterima dg baik dan berfungsi dg baik. Bisa fast charging ke HP redmi saya.,produk sudah diterima dg baik dan berfungsi dg baik bisa fast charging ke hp redmi saya,Positif,16,89,Panjang (>15 kata)
Xiaomi 17T (12GB+256GB),1,"kualitas kamera utama, lbh buruk dibanding 14T yg saya pake, akhirnya sy jual lg HP nya ini ..",kualitas kamera utama lbh buruk dibanding 14t yg saya pake akhirnya sy jual lg hp nya ini,Negatif,17,94,Panjang (>15 kata)
Xiaomi TV Box S (3rd Gen),5,paketnya sudah diterima dalam keadaan yang baik makasih ya ka Gbu 🙏,paketnya sudah diterima dalam keadaan yang baik makasih ya ka gbu,Positif,11,67,Sedang (9–15 kata)
POCO M7 Pro 5G (8/256G),5,bagus dan sesuai,bagus dan sesuai,Positif,3,16,Sangat Singkat (≤3 kata)
Xiaomi TV Box S (3rd Gen),5,"Tampilan Google TV, dan dapat dibuat beberapa akun juga. Remote dapat digunakan untuk on-off serta atur volume tv. Namun kabel HDMI tidak kompatible (tidak bisa koneksi)...",tampilan google tv dan dapat dibuat beberapa akun juga remote dapat digunakan untuk on off serta atur volume tv namun kabel hdmi tidak kompatible tidak bisa koneksi,Positif,27,172,Panjang (>15 kata)
Xiaomi Redmi Note 15 (6/128 GB),5,"Barang sesuai judul dan deksripsi, terima kasih...",barang sesuai judul dan deksripsi terima kasih,Positif,7,50,Singkat (4–8 kata)
Xiaomi 17T (12GB+512GB),5,puas banget sama produknya,puas banget sama produknya,Positif,4,26,Singkat (4–8 kata)
POCO X8 Pro Series,5,MBG : Mantap Banget Guyysss....makasi bosku barang mewah...,mbg mantap banget guyysss makasi bosku barang mewah,Positif,8,59,Singkat (4–8 kata)
POCO X8 Pro Series,5,thnkss,thnkss,Positif,1,6,Sangat Singkat (≤3 kata)
POCO X7 Pro 5G,5,barang mantap ekpedisi nya mantap. luar biasa minus kayaknya agak cepat panas tp mash dalam keaddab normal,barang mantap ekpedisi nya mantap luar biasa minus kayaknya agak cepat panas tp mash dalam keaddab normal,Positif,17,106,Panjang (>15 kata)
POCO C71 4+4G/128G,5,barang aman sampe rumah... packing aman,barang aman sampe rumah packing aman,Positif,6,39,Singkat (4–8 kata)
Redmi Pad 2 Pro (6GB/128GB) (8GB/256GB),5,"mantap dah, bagus pokoknya mah barang nya",mantap dah bagus pokoknya mah barang nya,Positif,7,41,Singkat (4–8 kata)
POCO X7 Pro 5G,5,"pesanan sesuai, performa ok",pesanan sesuai performa ok,Positif,4,27,Singkat (4–8 kata)
Xiaomi Monitor A27i,5,pengiriman cepat.. kualitas nya bagus.. layarnya jernih,pengiriman cepat kualitas nya bagus layarnya jernih,Positif,7,55,Singkat (4–8 kata)
POCO C71 4+4G/128G,5,"mantap, barang dpt sesuai ekspektasi",mantap barang dpt sesuai ekspektasi,Positif,5,36,Singkat (4–8 kata)
Xiaomi Earphone Tipe-C,5,kerennn,kerennn,Positif,1,7,Sangat Singkat (≤3 kata)
POCO C71 4+4G/128G,5,"bintang 5, terima kasih!",bintang 5 terima kasih,Positif,4,24,Singkat (4–8 kata)
Xiaomi Redmi 15C (6+128) (8+256),5,baik,baik,Positif,1,4,Sangat Singkat (≤3 kata)
POCO X8 Pro Series,5,mantap,mantap,Positif,1,6,Sangat Singkat (≤3 kata)
POCO X8 Pro Series,5,"sampai hari ini aman hpnya 
mantap poco",sampai hari ini aman hpnya mantap poco,Positif,7,39,Singkat (4–8 kata)
Xiaomi TV A Pro 43 2026,5,"Pesen pagi, sampai langsung besok sorenya pengiriman reguler jkt, termasuk sgt cepat. Barangnya oke, kualitas 4k UHD, keren bgt, antar platform disini paling murah. Keren",pesen pagi sampai langsung besok sorenya pengiriman reguler jkt termasuk sgt cepat barangnya oke kualitas 4k uhd keren bgt antar platform disini paling murah keren,Positif,25,170,Panjang (>15 kata)
Xiaomi 17T (12GB+256GB),5,"setelah 6 tahun bertahan dengan hp lama, akhirnya bisa ganti hp baru dan sejauh ini cukup memuaskan dengan performa apalagi kameranya yang apik😍 semoga penyimpanannya cu...",setelah 6 tahun bertahan dengan hp lama akhirnya bisa ganti hp baru dan sejauh ini cukup memuaskan dengan performa apalagi kameranya yang apik semoga penyimpanannya cu,Positif,26,172,Panjang (>15 kata)
Xiaomi Redmi 15C (6+128) (8+256),5,"Barang sesuai pesanan dan berfungsi dengan baik , terima kasih",barang sesuai pesanan dan berfungsi dengan baik terima kasih,Positif,9,62,Sedang (9–15 kata)
Xiaomi Redmi Watch 5 Active,5,"Baru sempat ulas, barang masih segel, pengiriman rapi dan aman, respon cepat dan semoga barang awet terus.
makasi xiaomi dan tokped.",baru sempat ulas barang masih segel pengiriman rapi dan aman respon cepat dan semoga barang awet terus makasi xiaomi dan tokped,Positif,21,132,Panjang (>15 kata)
Xiaomi 17T (12GB+256GB),5,"Benar2 sesuai harapan. Thank you, Xiaomi 🤗",benar2 sesuai harapan thank you xiaomi,Positif,6,42,Singkat (4–8 kata)
Xiaomi Redmi Watch 5 Active,5,"barang asli original,  enak dipakai tapi perlu banyak setingan",barang asli original enak dipakai tapi perlu banyak setingan,Positif,9,62,Sedang (9–15 kata)
Xiaomi Smart Band 9 Active,5,barang sesuai,barang sesuai,Positif,2,13,Sangat Singkat (≤3 kata)
Xiaomi Pad 7 (8/256GB),5,topppp,topppp,Positif,1,6,Sangat Singkat (≤3 kata)
Xiaomi 17T (12GB+256GB),4,"Saya kasih bintang 4 karena pilihan kurirnya, untuk kedatangan sesuai tapi lambat sekali. Overall very good and thanks",saya kasih bintang 4 karena pilihan kurirnya untuk kedatangan sesuai tapi lambat sekali overall very good and thanks,Positif,18,118,Panjang (>15 kata)
POCO M7 Pro 5G (8/256G),5,barang masih segel dan aman,barang masih segel dan aman,Positif,5,27,Singkat (4–8 kata)
Xiaomi Power Bank 22.5W 10000mAh Lite,5,"barang sudah sampai di lokasi, sesuai di deskripsi barang ori dan segel. Terima kasih",barang sudah sampai di lokasi sesuai di deskripsi barang ori dan segel terima kasih,Positif,14,85,Sedang (9–15 kata)
Xiaomi 17T (12GB+256GB),4,"Pengiriman , diterima barang sangat cepat . Aman tersegel, hanya sedikit penyok kardus luar. 
Semoga chipset , batre , kamera akan aman untuk penggunaan min 3-5th ke depa...",pengiriman diterima barang sangat cepat aman tersegel hanya sedikit penyok kardus luar semoga chipset batre kamera akan aman untuk penggunaan min 3 5th ke depa,Positif,25,173,Panjang (>15 kata)
Xiaomi 17T (12GB+256GB),5,Sampai dengan selamat packing aman. Headphones bonusnya mantep banget ada noise cancellation dan jadi keinget kalau dulu beli HP pasti ada bonus headsetnya. Semoga ke dep...,sampai dengan selamat packing aman headphones bonusnya mantep banget ada noise cancellation dan jadi keinget kalau dulu beli hp pasti ada bonus headsetnya semoga ke dep,Positif,26,173,Panjang (>15 kata)
Xiaomi Wifi Range Extender N300,5,"Sesuai deskripsi dan sesuai Pic. packing ok mendarat dengan aman dan selamat, barang datang sesuai pesanan, untuk settingnya simpel, mudah tinggal ikuti petunjuk yang di...",sesuai deskripsi dan sesuai pic packing ok mendarat dengan aman dan selamat barang datang sesuai pesanan untuk settingnya simpel mudah tinggal ikuti petunjuk yang di,Positif,25,172,Panjang (>15 kata)
POCO X8 Pro Series,5,Mantapppp sweeekaleeee,mantapppp sweeekaleeee,Positif,2,22,Sangat Singkat (≤3 kata)
Xiaomi 67W HyperCharge Combo Tipe A,5,mantabbbbb...,mantabbbbb,Positif,1,13,Sangat Singkat (≤3 kata)
Xiaomi Redmi Buds 6,4,"packiging nya amburadul banget
selain itu barang berfungsi dengan baik",packiging nya amburadul banget selain itu barang berfungsi dengan baik,Positif,10,70,Sedang (9–15 kata)
POCO X7 Pro 5G,5,segel original .terimakasih poco indonesia ..mantapp jos,segel original terimakasih poco indonesia mantapp jos,Positif,7,56,Singkat (4–8 kata)
POCO X7 Pro 5G,5,barang segel tanpa kendala .original.terimakasih banyak.sukses,barang segel tanpa kendala original terimakasih banyak sukses,Positif,8,62,Singkat (4–8 kata)
POCO X7 Pro 5G,5,original mantap .terimakasih,original mantap terimakasih,Positif,3,28,Sangat Singkat (≤3 kata)
Xiaomi 17T (12GB+256GB),5,"Barang sampai cepet banget, packaging bagus dan overall puas, semoga bisa awet",barang sampai cepet banget packaging bagus dan overall puas semoga bisa awet,Positif,12,78,Sedang (9–15 kata)
Xiaomi 17T (12GB+256GB),5,baterainya badakkk,baterainya badakkk,Positif,2,18,Sangat Singkat (≤3 kata)
Xiaomi Redmi Buds 8 Lite,5,bagus dan bisa berfungsi dengan baik,bagus dan bisa berfungsi dengan baik,Positif,6,36,Singkat (4–8 kata)
Xiaomi Smart Band 9 Active,5,"rapi, cepat, barang berkualitas.",rapi cepat barang berkualitas,Positif,4,32,Singkat (4–8 kata)
Xiaomi 17T (12GB+256GB),1,"Xiaomi Indonesia sepertinya tidak mau menjaga barang pelanggan. packing gak niat dan sangat amat tipis , Box HP sampai dalam kondisi bonyok .., sangat amat mengecewakan �...",xiaomi indonesia sepertinya tidak mau menjaga barang pelanggan packing gak niat dan sangat amat tipis box hp sampai dalam kondisi bonyok sangat amat mengecewakan,Negatif,24,173,Panjang (>15 kata)
Xiaomi Nose Hair Trimmer,5,"Good service.
Pengiriman cepat.
Packing produk bagus.
Recommended seller.",good service pengiriman cepat packing produk bagus recommended seller,Positif,9,73,Sedang (9–15 kata)
POCO C71 4+4G/128G,5,good,good,Positif,1,4,Sangat Singkat (≤3 kata)
Xiaomi Vacuum Cleaner G20 Lite,5,Terima kasih xiaomi,terima kasih xiaomi,Positif,3,19,Sangat Singkat (≤3 kata)
Xiaomi Redmi Buds 6 Active,5,Ok mantaap soundnya,ok mantaap soundnya,Positif,3,19,Sangat Singkat (≤3 kata)
Xiaomi Robot Vacuum S40C,5,"Pertama beli robot vakum tadinya skeptis, a pleasant surprise dg efektifitas nya. Lasernya akurat dlm memetakan jd nggak ada yg kelewat dan dlm navigasi jd nggak sering n...",pertama beli robot vakum tadinya skeptis a pleasant surprise dg efektifitas nya lasernya akurat dlm memetakan jd nggak ada yg kelewat dan dlm navigasi jd nggak sering n,Positif,28,173,Panjang (>15 kata)
Xiaomi Redmi A7 Pro (4+64 GB) (4+128 GB),5,mantul,mantul,Positif,1,6,Sangat Singkat (≤3 kata)
Xiaomi 17T (12GB+256GB),5,"barang diterima dengan baik, masih bersegel n terbungkus dgn rapi n aman,sdh dicoba,hp berfungsi baik.. semua sesuai dgn yg sy harap",barang diterima dengan baik masih bersegel n terbungkus dgn rapi n aman sdh dicoba hp berfungsi baik semua sesuai dgn yg sy harap,Positif,23,132,Panjang (>15 kata)
Xiaomi 17T (12GB+256GB),5,"masih segel,, cuma minus kemasan kardus packing nya aja yg penyok + sampai ada lubang,, untung barang di dlam nya aman.",masih segel cuma minus kemasan kardus packing nya aja yg penyok sampai ada lubang untung barang di dlam nya aman,Positif,20,119,Panjang (>15 kata)
Xiaomi Smart Camera C301,5,"original n good product, fast response, recommended seller. thank you.",original n good product fast response recommended seller thank you,Positif,10,70,Sedang (9–15 kata)
Xiaomi Outdoor Camera CW300,5,"original n good product, fast response, recommended seller. thank you.",original n good product fast response recommended seller thank you,Positif,10,70,Sedang (9–15 kata)
Xiaomi TV Stick 4K 2nd Gen,5,barang sampai dengan aman langsung d coba berfungsi dengan baik thanks ya,barang sampai dengan aman langsung d coba berfungsi dengan baik thanks ya,Positif,12,73,Sedang (9–15 kata)
Xiaomi 17T (12GB+256GB),5,Build quality Xiaomi sangat bagus.. Warna violetnya kalem keren.. Performa mesin & kamera mantap.. Proses dan pengiriman cepat. Packaging aman,build quality xiaomi sangat bagus warna violetnya kalem keren performa mesin kamera mantap proses dan pengiriman cepat packaging aman,Positif,19,142,Panjang (>15 kata)
"Xiaomi TV A 43"" FHD 2026",5,"pengiriman cepat, dapat harga khusus tanggal kembar",pengiriman cepat dapat harga khusus tanggal kembar,Positif,7,51,Singkat (4–8 kata)
Xiaomi Redmi Buds 8 Pro,5,"On time , sesuai, bagus…semoga awet.",on time sesuai bagus semoga awet,Positif,6,36,Singkat (4–8 kata)
Xiaomi 3A USB-A to USB-C Cable (1m),4,Produk saya rasa ini emang original dari xiaomi nya... tapi sangat disayangkan... kusus untuk produk kabel yang USB 3A ini tidak mendukung pengisian Mi Turbo nya di karna...,produk saya rasa ini emang original dari xiaomi nya tapi sangat disayangkan kusus untuk produk kabel yang usb 3a ini tidak mendukung pengisian mi turbo nya di karna,Positif,28,173,Panjang (>15 kata)
Xiaomi Redmi Pad 2 Series,5,mantap,mantap,Positif,1,6,Sangat Singkat (≤3 kata)
POCO X8 Pro Series,5,Kerenn,kerenn,Positif,1,6,Sangat Singkat (≤3 kata)
POCO X8 Pro Series,5,josssss,josssss,Positif,1,7,Sangat Singkat (≤3 kata)
Xiaomi Redmi Watch 5 Active,5,"harga bersaing, pengiriman cepat",harga bersaing pengiriman cepat,Positif,4,32,Singkat (4–8 kata)
Xiaomi Power Bank 22.5W 10000mAh Lite,5,mantap,mantap,Positif,1,6,Sangat Singkat (≤3 kata)
Xiaomi Wifi Range Extender N300,4,kualitas oke,kualitas oke,Positif,2,12,Sangat Singkat (≤3 kata)
Xiaomi Vacuum Cleaner G20,5,kualitas ok barang super mulus tak cacat pengiriman aman,kualitas ok barang super mulus tak cacat pengiriman aman,Positif,9,56,Sedang (9–15 kata)
Xiaomi 17T (12GB+256GB),5,mantap,mantap,Positif,1,6,Sangat Singkat (≤3 kata)
Xiaomi Redmi 15 (8/128) (8/256),5,Bagus,bagus,Positif,1,5,Sangat Singkat (≤3 kata)
POCO X8 Pro Series,5,"packing aman, sesuai pesanan, pengiriman cepat, berfungsi dengan baik. terimakasih",packing aman sesuai pesanan pengiriman cepat berfungsi dengan baik terimakasih,Positif,10,82,Sedang (9–15 kata)
POCO C85 (6/128) (8/256),5,"Barang msh segel, berfungsi dengan baik, penjual responsif, packing aman, pengiriman cepat, terima kasih",barang msh segel berfungsi dengan baik penjual responsif packing aman pengiriman cepat terima kasih,Positif,14,104,Sedang (9–15 kata)
Xiaomi 17T (12GB+256GB),5,"barang aman jaya mntap 
pengiriman cepat bangatt
dapat harga spesial",barang aman jaya mntap pengiriman cepat bangatt dapat harga spesial,Positif,10,68,Sedang (9–15 kata)
POCO M7 Pro 5G (8/256G),5,"barang sampai dengan aman dan selamat, thanks admin",barang sampai dengan aman dan selamat thanks admin,Positif,8,51,Singkat (4–8 kata)
POCO M7 (8GB/256GB),5,"Gacor!!!! Puas sekali ini sudah 4 kali saya beli di Toko ini, 3 hari langsung sampai dirumah saya, Kurirnya antar langsung di depan pintu rumah, kualitas barang juga 100%...",gacor puas sekali ini sudah 4 kali saya beli di toko ini 3 hari langsung sampai dirumah saya kurirnya antar langsung di depan pintu rumah kualitas barang juga 100,Positif,29,173,Panjang (>15 kata)
Xiaomi 3A USB-A to USB-C Cable (1m),5,"Bagus, ini untuk dibawah 33watt cocok, karena kabel ini belum support mi turbo charging.",bagus ini untuk dibawah 33watt cocok karena kabel ini belum support mi turbo charging,Positif,14,88,Sedang (9–15 kata)
POCO X8 Pro Series,5,"GGGAAACOOORRRRR, GACOR, saya sangat puas, Pelayanan Cepat Sekali, Kurir Langsung di Depan Pintu, Kualitas Barang 100%",gggaaacooorrrrr gacor saya sangat puas pelayanan cepat sekali kurir langsung di depan pintu kualitas barang 100,Positif,16,117,Panjang (>15 kata)
Xiaomi Smart Band 10,5,di terima dgn baik dan berfungsi dgn baik.,di terima dgn baik dan berfungsi dgn baik,Positif,8,42,Singkat (4–8 kata)
Xiaomi Mijia Electric Air Compressor Series,5,proses cepat barang sesuai pesanan,proses cepat barang sesuai pesanan,Positif,5,34,Singkat (4–8 kata)
Xiaomi Gaming Monitor G24i 2026,5,setelah di pakai kerja dan seharian terasa adem di mata dan terlihat mewahserta elegan,setelah di pakai kerja dan seharian terasa adem di mata dan terlihat mewahserta elegan,Positif,14,86,Sedang (9–15 kata)
Xiaomi Smart Air Purifier 4 Compact,5,"Kamarku jadi lebih baik udaranya, emang agak parah di jam tertentu karena rumah disamping jalan tol dan kadang ada orang tidak bertanggung jawab membakar sampah sembarang...",kamarku jadi lebih baik udaranya emang agak parah di jam tertentu karena rumah disamping jalan tol dan kadang ada orang tidak bertanggung jawab membakar sampah sembarang,Positif,26,173,Panjang (>15 kata)
POCO C71 4+4G/128G,5,Mantul,mantul,Positif,1,6,Sangat Singkat (≤3 kata)
POCO C81 Pro (4GB/128G) (4GB/64GB),5,Mantul,mantul,Positif,1,6,Sangat Singkat (≤3 kata)
Xiaomi Redmi Note 15 (8/128 GB) (8/256 GB),5,good,good,Positif,1,4,Sangat Singkat (≤3 kata)
Xiaomi 17T (12GB+256GB),5,beli warna violet karna Sheila Dara 💜,beli warna violet karna sheila dara,Positif,6,37,Singkat (4–8 kata)
"Xiaomi TV A 43"" FHD 2026",5,Good,good,Positif,1,4,Sangat Singkat (≤3 kata)
Xiaomi Power Bank 22.5W 10000mAh Lite,5,semoga oke,semoga oke,Positif,2,10,Sangat Singkat (≤3 kata)
POCO X8 Pro Series,5,"barang Masih di segel waktu datang, pengiriman terpercaya dan aman. kondisi HP normal Dan mulus",barang masih di segel waktu datang pengiriman terpercaya dan aman kondisi hp normal dan mulus,Positif,15,95,Sedang (9–15 kata)
Xiaomi Redmi Buds 6 Play,5,nice dream,nice dream,Positif,2,10,Sangat Singkat (≤3 kata)
Xiaomi 67W Power Bank 20000mAh (Integrated Cable),5,"barang sampai dengan aman, pengiriman cepat.. berfungsi dengan baik di tes pada xiaomi 15 T turbo charging aktif..",barang sampai dengan aman pengiriman cepat berfungsi dengan baik di tes pada xiaomi 15 t turbo charging aktif,Positif,18,114,Panjang (>15 kata)
POCO M7 (8GB/256GB),5,asli resmi,asli resmi,Positif,2,10,Sangat Singkat (≤3 kata)
Xiaomi 17T (12GB+256GB),4,"ada indikasi terbuka kardusnya, untung saja masih aman hp dan headphones belum ada dibuka",ada indikasi terbuka kardusnya untung saja masih aman hp dan headphones belum ada dibuka,Positif,14,89,Sedang (9–15 kata)
Xiaomi 17T (12GB+256GB),5,hpnya keren,hpnya keren,Positif,2,11,Sangat Singkat (≤3 kata)
Xiaomi Redmi Note 15 (8/128 GB) (8/256 GB),5,"Toko cepat respon, sehari langsung sampai. Kurirnya juga amanah. Barang sesuai diskripsi dan diterima dalam kondisi tersegel. Operasional hp sampai saat ini masih aman da...",toko cepat respon sehari langsung sampai kurirnya juga amanah barang sesuai diskripsi dan diterima dalam kondisi tersegel operasional hp sampai saat ini masih aman da,Positif,25,173,Panjang (>15 kata)
Xiaomi 120W HyperCharge Combo Tipe-A,5,Pesanan sdh sampai dalam keadaan baik. Semoga awet,pesanan sdh sampai dalam keadaan baik semoga awet,Positif,8,50,Singkat (4–8 kata)
Xiaomi Earphone Tipe-C,5,alternatif earphone type C yg terjangkau,alternatif earphone type c yg terjangkau,Positif,6,40,Singkat (4–8 kata)
POCO X8 Pro Series,5,Barang aman,barang aman,Positif,2,11,Sangat Singkat (≤3 kata)
POCO X8 Pro Series,5,barang aman,barang aman,Positif,2,11,Sangat Singkat (≤3 kata)
Xiaomi 17T (12GB+256GB),5,"barang sesuai
pengiriman cepat
toko amanah,respon cepat
paking aman,barang sampai tujuan dgn selamat",barang sesuai pengiriman cepat toko amanah respon cepat paking aman barang sampai tujuan dgn selamat,Positif,15,100,Sedang (9–15 kata)
